{
  "schemaVersion": 1,
  "auditId": "ra-ce903d3b48",
  "channel": "concept",
  "batchId": null,
  "sourceAssetId": "restraint.pose.houshou-guanyin",
  "sourcePath": "src/game/data/outline_relation_graph/conceptRegistry.js",
  "sourceTitle": "后手观音",
  "sourceAuthor": "seed",
  "themeDomain": "restraint-themed",
  "currentResult": {
    "conceptId": "restraint.pose.houshou-guanyin",
    "canonicalName": "后手观音",
    "aliases": [
      "后手观音式",
      "观音反手"
    ],
    "parentConcepts": [
      "restraint.upper-body.restricted"
    ],
    "layer": "concept",
    "visibility": {
      "primaryTag": false,
      "detailPanel": true,
      "graph": true,
      "searchable": true,
      "ragRetrievable": true
    },
    "summary": "双手于身后特定相对位置形成的可识别紧缚姿态细节。"
  },
  "reportedIssue": "概念别名与 RAG 卡标题未对齐",
  "correctResult": "概念与 RAG 卡 title/aliases 对齐，并补 explains",
  "issueCategories": [
    "missing-rag-link",
    "naming-inconsistency"
  ],
  "isSingleCase": true,
  "mayBecomeGeneralRule": false,
  "relatedSkills": [
    "outline-relation-graph",
    "liluo-external-fiction-knowledge"
  ],
  "fixStatus": "recorded",
  "needsIndexRebuild": false,
  "rebuildScope": {
    "sourcePaths": [
      "src/game/data/outline_relation_graph/conceptRegistry.js"
    ],
    "assetIds": [
      "restraint.pose.houshou-guanyin"
    ],
    "fields": []
  },
  "skillUpgradeDecision": {
    "suggested": false,
    "reason": "标记为个例或未声明可成通用规则；单次错误不升级 Skill",
    "patternGroupId": null,
    "userExplicitRuleRequest": false,
    "approvedByUser": false
  },
  "hitCountHint": null,
  "confidenceNotes": "",
  "notes": "",
  "createdAt": "2026-07-28T07:49:36.319Z",
  "updatedAt": "2026-07-28T07:49:36.343Z",
  "reviewedAt": "2026-07-28T07:49:36.319Z",
  "relatedAdjustments": [
    {
      "channel": "concept",
      "assetId": "restraint.upper-body.restricted",
      "title": "上肢受限",
      "path": "src/game/data/outline_relation_graph/conceptRegistry.js",
      "relation": "parent",
      "action": "needed",
      "note": "修正主条目时请一并检查；有需要则同步调整"
    },
    {
      "channel": "rag",
      "assetId": "rag.restraint.effect.tickling",
      "action": "adjusted",
      "note": "已同步卡定义与别名"
    }
  ],
  "relatedReviewComplete": true
}
